{
  "schema_version": "1.0",
  "action_id": "4d5e6f7a-8b9c-4d4e-bf5a-6b7c8d9eafb0",
  "success": false,
  "operation_status": "UNKNOWN",
  "data_refs": [
    {
      "ref": "5e6f7a8b-9cad-4e5f-8a6b-7c8d9eafb0c1",
      "trust": "untrusted"
    }
  ],
  "evidence_refs": [
    "7a8b9cad-becf-4a7b-ac8d-9eafb0c1d2e3"
  ],
  "external_reference": null,
  "retry_class": "AFTER_RECONCILIATION",
  "error": {
    "code": "EXTERNAL_EFFECT_UNKNOWN",
    "message": "connection dropped after submit"
  },
  "observability": {
    "tool_id": "messaging.send_owner_artifact",
    "tool_version": "1.0.0",
    "duration_ms": 1834
  }
}
